{
  "schema": "wellmanifest.gui/page/v1",
  "$schema": "https://wellmanifest.com/schemas/gui-page/v1",
  "id": "subactor.www/marketplace",
  "version": "1.4.0",
  "title": "Partner marketplace",
  "placement": {
    "home": "subactor",
    "shape": "runtime_service",
    "adopt": "wellmanifest/gui",
    "runtimeOwner": "subactor"
  },
  "page": {
    "kind": "marketplace",
    "role": "public",
    "source": "observed",
    "url": "http://127.0.0.1:8781/marketplace",
    "family": "commerce",
    "intentKind": "marketplace"
  },
  "structure": {
    "landmarks": {
      "main": true,
      "footer": true,
      "h1": "Partner marketplace",
      "form": false,
      "article": false,
      "listing": true,
      "headingOutline": [
        {
          "tag": "H1",
          "text": "Partner marketplace"
        }
      ]
    },
    "chrome": {
      "itemSectionToolbar": false,
      "itemViewSwitch": false,
      "sectionAddButton": false,
      "sectionViewToolbar": false,
      "viewport": false,
      "itemView": false,
      "hamburger": false
    }
  },
  "visual": {
    "budgets": {
      "fontFamilies": 3,
      "colors": 8,
      "fontSizes": 5
    },
    "counts": {
      "fontFamilies": 2,
      "colors": 5,
      "fontSizes": 6
    },
    "tokens": {
      "fontFamilies": [
        {
          "value": "Inter",
          "count": 47
        },
        {
          "value": "ui-monospace",
          "count": 10
        }
      ],
      "colors": [
        {
          "value": "rgb(242, 242, 242)",
          "count": 41
        },
        {
          "value": "rgb(34, 211, 197)",
          "count": 38
        },
        {
          "value": "rgb(255, 255, 255)",
          "count": 31
        },
        {
          "value": "rgb(154, 154, 154)",
          "count": 4
        },
        {
          "value": "rgb(17, 17, 17)",
          "count": 2
        }
      ],
      "fontSizes": [
        {
          "value": "17.1px",
          "count": 24
        },
        {
          "value": "18px",
          "count": 14
        },
        {
          "value": "14.4px",
          "count": 9
        },
        {
          "value": "15.75px",
          "count": 8
        },
        {
          "value": "36px",
          "count": 1
        },
        {
          "value": "14.76px",
          "count": 1
        }
      ]
    }
  },
  "appliesPrinciples": [
    "site-footer",
    "page-kind",
    "visual-budget"
  ],
  "defects": [
    {
      "code": "GUI-VIS-TYPE-001",
      "severity": "warn",
      "message": "6 font sizes (budget 5)"
    }
  ]
}
